title,price,description,distCity,uptime,productArea,photoSample
*CHÍNH CHỦ* BÁN ĐẤT - ĐƯỜNG NGUYỄN NHƯỢC PHÁP - PHƯỚC LÝ - HÒA MINH - LIÊN CHIỂU.,3.45 tỷ,"Cần tiền Xây Nhà nên tôi Bán Lô Đất mặt đường Nguyễn Nhược Pháp. + Diện Tích: 100m2. + Mặt Tiền: 5m. + Đường 10,5m. + Sổ đỏ đứng tên tôi ( chính chủ ) GIÁ: 3 tỷ 450 triệu ( có bớt cho thiện chí mua )...","Liên Chiểu, Đà Nẵng",19/04/2022,100 m²,
"CHÍNH CHỦ CẦN BÁN MẶT TIỀN ĐƯỜNG LÊ VĂN THỨ, SƠN TRÀ. GIÁ RẺ NHẤT THỊ TRƯỜNG",75 triệu/m²,Tôi chính chủ cần bán mặt tiền đường Lê Văn Thứ - Tuyến đường thông xuyên suốt từ Ngô Quyền thông ra mặt biển Võ Nguyên Giáp giá rẻ nhất thị trường. Giá chỉ: 75 triệu/m2. Liên hệ: Thảo L...,"Sơn Trà, Đà Nẵng",18/04/2022,140 m²,
TÔI CẦN BÁN GẤP RẺ HƠN THỊ TRƯỜNG 600TR - CĂN SHOPHOUSE BIỂN GIÁ CHỈ HƠN 12 TỶ TÍ THÔI 0848990***,12.5 tỷ,"Giá nhà thuê khu vực này nhà thô 25tr - nhà hoàn thiện là 40tr. Vừa ở vừa cho thuê có ngay dòng tiền + giá trị BĐS lại tăng theo thời gian.Cần bán shophouse tâm huyết. - 4 tầng, 2 mặt tiền đường Nguyễn Sinh Sắc rộng 60m. - Đường sau nhà rộng 7.5m. - Đối diện trung tâm quận Liên Chiểu, Đà Nẵng. - Cách bệnh viện 200m. - Diện tích đất: 7x20m = 140m2. - Diện tích sàn xây dựng: 497m...","Liên Chiểu, Đà Nẵng",16/04/2022,140 m²,
"CẦN BÁN KHÁCH SẠN 5 TẦNG ĐƯỜNG AN HẢI ĐÔNG 1, TRUNG TÂM PHỐ BIỂN ĐÀ NẴNG",Giá thỏa thuận,"Vị trí: - Cách đường vàng Nguyễn Văn Thoại tầm 30m. - Sát bãi biển. - Khu vực trung tâm của phố biển Đà Nẵng. - Vị trí miễn bàn. - Khách sạn đang hoạt động tốt. - Công suất 5 tầng, 17 phòng, full nội thất, có thang máy. - DT sàn đang sử dụng 849m2. - DT đất: 155,8m2. - Hướng: Đông Bắc. - Giá chỉ: 2X tỷ. - Liên hệ, xem, đặt cọc ngay.","Sơn Trà, Đà Nẵng",15/04/2022,155.8 m²,
"CẦN BÁN KHÁCH SẠN VIP TRUNG TÂM BIỂN MỸ KHUÊ, CÁCH VÕ NGUYÊN GIÁP 40M",Giá thỏa thuận,"Cần bán khách sạn vị trí siêu đẹp. - Vị trí cách đường Võ Nguyên Giáp 40m. - Ngay khu trung tâm của phố biển Đà Nẵng. - Ngay khu Phố Tây An Thượng. - Sát bãi tắm Mỹ Khuê Đà Nẵng. - Vị trí vip. - Khách sạn đang hoạt động tốt, diện tích sử dụng 4 tầng. Sử dụng 17 phòng, có thang máy. - Diện tích sàn đang sử dụng là: 716m2. - Diện tích đất: 328m2. - Hướng: Tây Bắc. - Giá chỉ: 2X t...","Ngũ Hành Sơn, Đà Nẵng",15/04/2022,328 m²,
"BIỆT THỰ FUSION RESORT & VILLAS DA NANG VỊ TRÍ ĐỘC TÔN, SẢN PHẨM GIỚI HẠN - 0932560***",Giá thỏa thuận,Fusion Resort & Villas Da Nang có gì hot mà 6/2019 KH mang balo tiền ra tận Hà Nội để dự lễ mở bán và rất nhiều KH không mua được...Quy mô 15.075 ha chỉ có 85 căn biệt thự GĐ1 đã bán 44 căn. GĐ2 chỉ ...,"Ngũ Hành Sơn, Đà Nẵng",14/04/2022,537 m²,
CHIẾT KHẤU ĐẾN 14% KHI SỞ HỮU CĂN HỘ LUXURY VIEW BIỂN LÂU DÀI 5* HIẾM HOI TẠI THỊ TRƯỜNG ĐÀ NẴNG,5.8 tỷ,"The Sang Residence - Tòa căn hộ duy nhất ở Đà Nẵng sở hữu quỹ đất khan hiếm sát biển Mỹ Khê với vị trí cực kì đắc địa, sổ hồng sở hữu vĩnh viễn. Không bỏ lỡ cơ hội duy nhất sở hữu căn hộ view biển tr...","Ngũ Hành Sơn, Đà Nẵng",13/04/2022,82.5 m²,
"CẦN BÁN NHÀ CÓ GÁC ĐÚC ĐƯỜNG TRƯỜNG CHINH, PHƯỜNG AN KHÊ",2.495 tỷ,"Đang cần tiền nên cần bán lại ngôi nhà, tâm huyết của 2 vợ chồng xây dựng nên, ngôi nhà nằm ngay hai mặt kiệt, thông thoáng mát mẻ, kiệt 4m 5 ô tô ra vào rộng rãi, đường thông ra Nguyễn Phước Nguyên, chợ Thẩm lên, nằm cạnh bên trường cấp 1 An khê, rất thuận tiện cho con cái học, nhà có đổ gác đúc gồm 3Pn, phòng thờ, khách, bếp, WC. DT: Đất 54m2. DTSD: 85m2. Lh : để xem nhà","Thanh Khê, Đà Nẵng",19/04/2022,54 m²,
"BÁN ĐẤT HÒA LIÊN 5, ĐÀ NẴNG, HIỆN GIÁ RẺ NHẤT 1 TỶ 670 TRIỆU",1.67 tỷ,"Bán đất Hòa Liên Hòa Vang, Đà Nẵng.* Bán đất Hòa Liên 2: Giá 1 tỷ 670 triệu. - Đất đường rộng 7m5 giá 1 tỷ 700 triệu.* Bán đất Hòa Liên 3: Giá 1 tỷ 750 triệu. Trục chính hòa Liên 2 và 3 giá 2,1 tỷ.* ...","Hòa Vang, Đà Nẵng",19/04/2022,150 m²,
"CẦN BÁN NHÀ SƠN THỦY ĐÔNG 1. DT: 90M2, ĐƯỜNG 5M5 LỀ 3M",5.2 tỷ,"Cần bán nhà Sơn Thủy Đông 1. DT: 90m2, đường 5m5. Vị trí: Trục đường thông với Nguyễn Xiển, Nguyễn Cơ Thạch, nhà đẹo nằm trong khu bãi tắm Sơn Thủy, cách biển chỉ 5p đi bộ, đang có hợp đồng cho thuê 7 triệu. Giá chính chủ: 5,2 tỷ. Liên hệ: .","Ngũ Hành Sơn, Đà Nẵng",19/04/2022,90 m²,
"CẦN BÁN ĐẤT SƠN THỦY 3, HƯỚNG TÂY, ĐƯỜNG 7M5. DT:127,5M2",6.5 tỷ,"Cần bán đất mặt tiền Sơn Thủy 3, quận ngủ hành sơn. DT: 127,5m2, đường 7m5, hướng tây. Cách bãi tắm Sơn Thủy 5p đi bộ. Giá: 6,5 tỷ. Liên hệ: 0763647***.","Ngũ Hành Sơn, Đà Nẵng",19/04/2022,127.5 m²,
"CẦN BÁN ĐẤT SƠN THỦY 3, HƯỚNG ĐÔNG, ĐƯỜNG 7M5, DT:115M2",6.7 tỷ,"Cần bán đất Sơn Thủy 3, đường 7m5, nhà hướng Đông, cách bãi biển 5p đi bộ, phù hợp làm căn hộ cho thuê, giá 6,7 tỷ, liên hệ: 0769475***","Ngũ Hành Sơn, Đà Nẵng",19/04/2022,115 m²,
BÁN CĂN HỘ CHUNG CƯ SƠN TRÀ OCEAN VIEW. LIÊN HỆ NGAY 0983214*** ĐỂ ĐƯỢC TƯ VẤN GIÁ TỐT NHẤT,2.55 tỷ,"Bán căn góc hướng biển. - Diện tích: 68m2, đã hoàn thiện nội thất. - Pháp lí đang chờ sổ. Gía bán 2,55 tỷ. Liên hệ ngay 0983214*** (chị Ngọc) để xem nhà và thương lượng.","Sơn Trà, Đà Nẵng",19/04/2022,68 m²,
"CẦN BÁN VÀI LÔ GÓC SIÊU ĐẸP, VỊ TRÍ KINH DOANH - HÒA XUÂN, CẨM LỆ",Giá thỏa thuận,Cần chuyển nhượng vài lô góc cho khách thiện chí. 1. Góc 2MT Block: B1.33 lô 1 (diện tích: 130m2). - Đường Hoàng Hiệp và đường Bùi Thiện Ngộ. 2. Góc 2mt Block: B1.119 lô 1 (diện tích: 160m2). - Đường...,"Cẩm Lệ, Đà Nẵng",19/04/2022,160 m²,
CHÍNH CHỦ BÁN LÔ ĐẤT HOÀ LIÊN 2/3/4/5 - LIÊN HỆ 0905566***,Giá thỏa thuận,"- Đất Hòa Liên 2 - đường 5m5 - giá 1tỷ680 triệu. - Đất Hòa Liên 3 - đường 5m5 - giá 1tỷ740 triệu. - Đất Hòa Liên 4 - đường 5m5 - giá 1tỷ780 triệu đến 1,9 tỷ. - Đất Hòa Liên 5 - đường 5m5 - giá 1tỷ860...","Hòa Vang, Đà Nẵng",19/04/2022,152 m²,
"CHỦ BÁN BIỆT THỰ 2 MẶT TIỀN BÊN SÔNG CỔ CÒ 28KM, GIÁ GỐC CĐT, HÀNG HIẾM SIÊU HOT CHO QUÝ KH",25.999 tỷ,"Chính chủ bán biệt thự One River Đà Nẵng mặt sông Cổ Cò.- Mặt tiền đường Song Hào 33m. - 1 mặt giáp công viên siêu thoáng! - Mặt sau nhà là đường đi bộ mặt tiền sông Cổ Cò thơ mộng. Vị trí hot nhất dự án anh chị quan tâm gọi ngay vì căn hot của dự án.* Thông tin sơ bộ. Pháp lý: Đã có sổ đỏ lâu dài từng căn. Diện tích đất: 300m2. Ngang 15m x 20m. Xây 3 tầng, bàn giao ...","Ngũ Hành Sơn, Đà Nẵng",18/04/2022,300 m²,
MỞ ĐẶT CHỖ 100 CĂN THE SANG RESIDENCE - VIEW BIỂN - SỔ HỒNG - VAY 0% LÃI SUẤT + TẶNG NỘI THẤT 300TR,Giá thỏa thuận,Mở đặt chỗ giỏ hàng mới hơn 100 căn - The Sang Residence - view biển - sổ hồng - vay 0% lãi suất.- Đặt chỗ 50 triệu/ưu tiên (không mua hoàn tiền 100%). - Chiết khấu thêm 1% KH đặt chỗ. - Chiết khấu t...,"Ngũ Hành Sơn, Đà Nẵng",18/04/2022,82 m²,
SHOPHOUSE MÊ LINH - TRỤC CHÍNH KINH TẾ TÂY BẮC ĐÀ NẴNG CÓ 4 CĂN CẦN BÁN. LH: 0905309***,5.7 tỷ,1. Vị trí: - Thuộc khu kinh tế Tây Bắc Đà Nẵng - Quận Liên Chiểu. - Mặt tiền đường Mê Linh. - Nằm trong khu tổ hợp Kinh Tế thương mại và du lịch Đà Nẵng.2. Kết cấu nhà. - Bán Shophouse Lakeside Palac...,"Liên Chiểu, Đà Nẵng",18/04/2022,125.5 m²,
BÁN ĐẤT NỀN GIÁ RẺ NGAY TRUNG TÂM PHÁT TRIỂN PHẦN MỀM KHU ĐÔ THỊ FPT ĐÀ NẴNG,3.4 tỷ,"Cần bán lô B2.116 lô 27 Kẹp công viên vui chơi, nằm trên trục đường thông chạy ra Nam Kỳ Khởi Nghĩa, cách biển 500m, nằm trên bờ sông cổ cò thơ mộng, xung quanh là các trường đại học và trung học FPT sang sát nhau, các siêu thị và trung tâm thương mại đua nhau mọc lên, là một khu đô thị văn minh bậc nhất nằm trên tuyến đường huyết mạch chạy về trung tâm thành phố là nơi rất đ...","Ngũ Hành Sơn, Đà Nẵng",16/04/2022,108 m²,
BÁN CĂN HỘ CAO CẤP SỔ SỞ HỮU VĨNH VIỄN - MẶT TIỀN BIỂN MỸ KHÊ ĐÀ NẴNG - THE SANG RESIDENCE,Giá thỏa thuận,Cơ hội đầu tư & sinh sống - khi sở hửu 1 căn hộ view biển mỹ khê đà nẵng.5 lý do mà quý nhà đầu tư nên lưu ý khi đầu tư và sở hửu 1 căn hộ chung cư cao cấp tại Đà Nẵng.+ Dự án căn hộ The Sang Residen...,"Ngũ Hành Sơn, Đà Nẵng",16/04/2022,105.5 m²,
